sujet,date,statut
Les palettes limitées terre : harmonie minérale en peinture naturaliste,2025-10-15T06:04:58.787269,succès
Pourquoi les paysages de montagne inspirent-ils l'élévation spirituelle en art ?,2025-10-15T08:55:28.223838,succès
La forêt comme archétype jungien : inconscient collectif en peinture,2025-10-17T08:50:05.905357,succès
Comment les déserts incarnent-ils la quête intérieure en art spirituel ?,2025-10-20T08:50:21.817756,succès
L'eau comme symbole de l'inconscient en peinture symboliste,2025-10-22T08:58:02.218297,succès
Pourquoi les jardins clos représentent-ils le paradis perdu en art médiéval ?,2025-10-24T08:51:00.160166,succès
La montagne sacrée : du Sinaï au Fuji en iconographie religieuse,2025-10-28T07:36:36.468616,succès
Comment les arbres généalogiques structurent-ils la symbolique familiale en art ?,2025-11-04T07:35:46.781161,succès
Le labyrinthe végétal : égarement et quête en peinture allégorique,2025-11-11T07:37:57.847938,succès
Pourquoi l'horizon marin symbolise-t-il l'infini en peinture romantique ?,2025-11-18T07:22:21.780715,succès
Les quatre éléments en peinture : terre,2025-11-25T07:22:50.122590,succès
Comment la nature morte vanitas utilise-t-elle les fleurs pour parler de mort ?,2025-12-02T07:24:27.406021,succès
Le jardin d'Eden : persistance du paradis terrestre en art occidental,2025-12-09T07:24:33.565310,succès
Pourquoi les cascades symbolisent-elles le temps qui coule en art asiatique ?,2025-12-16T07:25:48.212811,succès
L'arbre de vie : symbole universel de la généalogie à la spiritualité,2025-12-23T07:26:30.018767,succès
Comment les saisons représentent-elles les âges de la vie en peinture ?,2025-12-30T07:25:39.607244,succès
Le rocher comme symbole de permanence face au changement en art,2026-01-06T07:28:08.150471,succès
Pourquoi les tempêtes maritimes incarnent-elles les tourments intérieurs ?,2026-01-13T07:28:08.387912,succès
La rosée matinale : pureté et renouveau en symbolisme naturel,2026-01-20T07:31:04.057375,succès
Comment les racines d'arbre symbolisent-elles l'ancrage identitaire en art ?,2026-01-27T07:37:25.318509,succès
Le désert fleuri : miracle et transformation en peinture spirituelle,2026-02-01T07:43:05.939080,succès
Pourquoi les chemins forestiers représentent-ils le voyage initiatique ?,2026-02-02T07:57:04.951051,succès
